User;Text;Date;Tweet Link;Media Links;Reply To
@merdekadotcom;20 Pinjol Masih Kurang Modal, Ini Langkah OJK http://dlvr.it/T18QCP;2024-01-09T13:42:20.000Z;https://x.com/merdekadotcom/status/1744716235164803364;[];
@detikfinance;Otoritas Jasa Keuangan (OJK) bicara nasib pemegang polis Jiwasraya yang menolak restrukturisasi ke PT Asuransi Jiwa IFG (IFG Life).;2024-01-09T13:41:47.000Z;https://x.com/detikfinance/status/1744716096593330572;[];
@detikfinance;OJK mengatakan telah mencabut izin usaha tiga perusahaan asuransi yakni Asuransi Prolife, PT Asuransi Purna Artanugraha dan Kresna Life.;2024-01-09T13:31:44.000Z;https://x.com/detikfinance/status/1744713569298714810;[];
@Media_Asuransi;Kepala Eksekutif Pengawas Asuransi, Dana Pensiun, dan Penjaminan OJK, Ogi Prastomiyono, dalam jumpa pers secara daring, Selasa, 9 Januari 2024 mengatakan, OJK mengapresiasi Kementrian BUMN Selesaikan Kasus Jiwasraya.;2024-01-09T13:31:08.000Z;https://x.com/Media_Asuransi/status/1744713416403780046;[];
@liputan6dotcom;OJK Cabut 3 Izin Perusahaan Asuransi, Ini Daftarnya http://dlvr.it/T18LQt #Bisnis;2024-01-09T13:09:10.000Z;https://x.com/liputan6dotcom/status/1744707888927694981;[];
@ProVokasi_UI;Program Pendidikan Vokasi Universitas Indonesia menggagas model pemeringkatan UMKM guna memperoleh penjaminan dan kredit perbankan dalam kegiatan Focus Group Discussion (FGD). FGD tersebut menghadirkan berbagai praktisi dari Otoritas Jasa Keuangan (OJK),;2024-01-09T13:07:26.000Z;https://x.com/ProVokasi_UI/status/1744707452518666516;['https://pbs.twimg.com/media/GDZyLPtbgAA8xOV?format=jpg&name=360x360', 'https://pbs.twimg.com/media/GDZyLPvaMAIyDg7?format=jpg&name=360x360', 'https://pbs.twimg.com/media/GDZyLPsaUAASuGl?format=jpg&name=360x360'];
@kompascom;Lowongan kerja OJK akan disediakan melalui Program Pendidikan Calon Staf (PCS).;2024-01-09T13:07:22.000Z;https://x.com/kompascom/status/1744707434869117354;[];
@idtodaycoid;Menko Polhukam Mahfud MD Minta OJK Atur Penyebaran Informasi Perbankan, Buntut Maraknya Penipuan dan Peretasan Lewat Whatsapp https://ift.tt/0Vhw6ZY;2024-01-09T13:07:20.000Z;https://x.com/idtodaycoid/status/1744707427772076355;[];
@idtodaycoid;OJK: Sektor Jasa Keuangan Kokoh Hadapi Potensi Perlambatan Pertumbuhan Ekonomi Global https://ift.tt/SRb82od;2024-01-09T13:07:17.000Z;https://x.com/idtodaycoid/status/1744707416040649000;[];
@inilahdotcom;Sepanjang 2023, banyak emiten dan pelaku jasa keuangan di pasar modal kena sanksi dari Otoritas Jasa Keuangan (OJK). Lantaran terlambat menyampaikan l...;2024-01-09T13:04:12.000Z;https://x.com/inilahdotcom/status/1744706640975450563;[];
@lathifahtriag14;Skrg balik lg dong ke sana pake id card ojk lo WKWKKWKWK;2024-01-09T13:02:41.000Z;https://x.com/lathifahtriag14/status/1744706257972576300;[];@tyraaldswn
@jambi_bro;OJK Perkuat Peraturan Pelindungan Konsumen dan Masyarakat https://jambibro.com/ojk-perkuat-peraturan-pelindungan-konsumen-dan-masyarakat/… @ojkindonesia;2024-01-09T13:01:15.000Z;https://x.com/jambi_bro/status/1744705895144251555;[];
@BloombergTZ;Usai Blokir 4 Ribu Rekening Judi Online, OJK Minta Ini ke Bank;2024-01-09T12:41:35.000Z;https://x.com/BloombergTZ/status/1744700948394725685;[];
@CNNIndonesia;OJK Ancam 13 Penyelenggara Pinjol Karena Masih Kenakan Bunga Tinggi;2024-01-09T12:41:25.000Z;https://x.com/CNNIndonesia/status/1744700904417403000;[];
@kumparan;OJK yakin pengembangan bursa karbon masih terus tumbuh di tahun 2024. #bisnisupdate #update #Bisnis #text;2024-01-09T12:41:07.000Z;https://x.com/kumparan/status/1744700830161490033;[];
@merdekadotcom;OJK Minta Bank Segera Blokir Rekening Terkait Pinjol Ilegal dan Judi Online http://dlvr.it/T18GPx;2024-01-09T12:36:13.000Z;https://x.com/merdekadotcom/status/1744699597929542095;[];
@merdekadotcom;OJK Buka-bukaan Soal Ancaman yang Pengaruhi Kinerja Sektor Keuangan 2024 http://dlvr.it/T18GMx;2024-01-09T12:36:07.000Z;https://x.com/merdekadotcom/status/1744699572902129991;[];
@Harian_Jogja;OJK Sebut Masih Ada 13 Belum Turunkan Bunga Pinjaman https://ekbis.harianjogja.com/read/2024/01/09/502/1161007/ojk-sebut-masih-ada-13-belum-turunkan-bunga-pinjaman?utm_source=dlvr.it&utm_medium=twitter… #beritajogja #jogja #jogjaistimewa;2024-01-09T12:33:06.000Z;https://x.com/Harian_Jogja/status/1744698813380796555;['https://pbs.twimg.com/media/GDZqUzFbwAAdPcG?format=jpg&name=small'];
@tommyaditiawan;Yang penting platformnya terdaftar di OJK;2024-01-09T12:20:11.000Z;https://x.com/tommyaditiawan/status/1744695562119815562;[];@eDzulfikar
@detikfinance;OJK menyatakan stabilitas sektor jasa keuangan Indonesia masih terjaga baik di tengah risiko perlambatan ekonomi global. Seperti apa keadaannya? finance.detik.com/berita-ekonomi-bisnis/d-7132298/begini-kondisi-sektor-jasa-keuangan-ri-di-tengah-perlambatan-ekonomi-global?utm_content=detikfinance&utm_term=echobox&utm_medium=oa&utm_campaign=detikcomsocmed&utm_source=Twitter#Echobox=1704787666-1…;2024-01-09T12:16:52.000Z;https://x.com/detikfinance/status/1744694728736600295;[];
@gowestid;Aturan Baru OJK untuk Perkuat Perlindungan Konsumen https://gowest.id/aturan-baru-ojk-untuk-perkuat-perlindungan-konsumen/… lewat @GoWest .ID;2024-01-09T12:12:34.000Z;https://x.com/gowestid/status/1744693646669369593;[];
@antarabiz;"OJK: 80 penyelenggara ITSK tercatat dalam ""Regulatory Sandbox""";2024-01-09T12:12:33.000Z;https://x.com/antarabiz/status/1744693640084230155;[];
@kumparan;OJK mengungkapkan pihaknya tengah memantau tujuh perusahaan asuransi. #bisnisupdate #update #Bisnis #text;2024-01-09T12:07:36.000Z;https://x.com/kumparan/status/1744692393184837886;[];
@kompascom;Dalam rangka memperkuat upaya pemberantasan praktik ilegal judi online, OJK juga meminta kepada perbankan untuk meningkatkan pengawasannya.;2024-01-09T12:04:13.000Z;https://x.com/kompascom/status/1744691543930445975;[];
@Bisniscom;Kinerja Pasar Modal 2023, OJK: IHSG Naik tapi Terjadi Outflow di Obligasi Korporasi;2024-01-09T11:59:33.000Z;https://x.com/Bisniscom/status/1744690371450609846;[];
@InvestorID;OJK melaporkan kinerja pasar modal RI berhasil tumbuh di setiap lini pada tahun 2023 lalu. https://investor.id/market/350645/2023-pasar-keuangan-ri-tumbuh-di-setiap-lini?utm_source=dlvr.it&utm_medium=twitter… #InvestorDaily #Keuangan #Investor;2024-01-09T11:58:04.000Z;https://x.com/InvestorID/status/1744689996634989010;[];
@InvestorID;OJK mengungkap proyeksi kinerja sektor perbankan tahun 2024, mulai dari pertumbuhan kredit dan sektor penopang, DPK, NPL, NIM, hingga laba. https://investor.id/finance/350644/proyeksi-perbankan-2024-kredit-npl-nim-hingga-laba?utm_source=dlvr.it&utm_medium=twitter… #InvestorDaily #Keuangan #Investor;2024-01-09T11:44:06.000Z;https://x.com/InvestorID/status/1744686481564991706;[];
@VIVAcoid;16 Pinjol hingga 35 Perusahaan Pembiayaan Kena Sanksi OJK;2024-01-09T11:41:13.000Z;https://x.com/VIVAcoid/status/1744685756831187058;[];
@abadikinicom;Judi Online Kian Menjamur di RI, OJK Perintahkan Blokir 4.000 Rekning http://dlvr.it/T187zF;2024-01-09T11:41:05.000Z;https://x.com/abadikinicom/status/1744685721741611352;[];
@kompascom;OJK mengeluarkan aturan baru terkait pemasaran produk asuransi unitlink.;2024-01-09T11:36:16.000Z;https://x.com/kompascom/status/1744684509625450576;[];
@VIVAcoid;OJK Segera Buka Lowongan Kerja, Ini Bocorannya http://dlvr.it/T187Rr;2024-01-09T11:36:16.000Z;https://x.com/VIVAcoid/status/1744684508312641913;[];
@ilhamiasnawi;OJK Minta Bank Blokir 4.000 Lebih Rekening Terkait Judi Online https://ekbis.sindonews.com/read/1294913/178/ojk-minta-bank-blokir-4000-lebih-rekening-terkait-judi-online-1704794463…;2024-01-09T11:33:50.000Z;https://x.com/ilhamiasnawi/status/1744683896074310014;[];
@ilhamiasnawi;OJK Segera Buka Lowongan Kerja, Ini Bocorannya https://viva.co.id/berita/bisnis/1675861-ojk-segera-buka-lowongan-kerja-ini-bocorannya…;2024-01-09T11:33:10.000Z;https://x.com/ilhamiasnawi/status/1744683728037982539;[];
@KATADATAcoid;OJK Optimis Skema Allowance Bakal Dorong Transaksi Bursa Karbon 2024 http://dlvr.it/T186Jk;2024-01-09T11:25:07.000Z;https://x.com/KATADATAcoid/status/1744681702436606354;[];
@bisnisindo_id;Daftar 99 Pinjol yang Terdaftar OJK Terbaru 2024;2024-01-09T11:24:15.000Z;https://x.com/bisnisindo_id/status/1744681485263933831;[];
@ilhamiasnawi;OJK Tegaskan Sektor Jasa Keuangan Terjaga Hadapi Perlambatan Ekonomi Global;2024-01-09T11:20:55.000Z;https://x.com/ilhamiasnawi/status/1744680645232902300;[];
@ilhamiasnawi;Terima 3.000 Aduan, OJK Ungkap Modus Penipuan yang Marak pada Momen Nataru https://viva.co.id/berita/bisnis/1675817-terima-3-000-aduan-ojk-ungkap-modus-penipuan-yang-marak-pada-momen-nataru…;2024-01-09T11:19:59.000Z;https://x.com/ilhamiasnawi/status/1744680410540646547;[];
@liputan6dotcom;Pindah dari Bappebti, Produk Derivatif Ini Bakal Diawasi OJK http://dlvr.it/T185cS #Bisnis;2024-01-09T11:18:33.000Z;https://x.com/liputan6dotcom/status/1744680051822731603;[];
@__kiyaaak;Pokoknya guys. Kalo udh urusan paylater, jangan pernah pinjemin saldomu untuk orang lain. Mau keluarga ataupun temen atau siapapun. Karena data kamu yang ‘jelek’ kalo pembayaran macet dan kamu yg dikejer kalo gagal bayar. Inget slik OJK mu dan BI checking https://x.com/haechangalaxy//haechangalaxy/status/1744316343493828744…;2024-01-09T11:16:11.000Z;https://x.com/__kiyaaak/status/1744679457280102495;[];
@kumparan;Peralihan pengawasan perdagangan kripto ke OJK akan selesai pada bulan Januari 2025. #bisnisupdate #update #bisnis #text;2024-01-09T10:57:12.000Z;https://x.com/kumparan/status/1744674678726066608;[];
@abdul200385;BRK Syariah Bersama OJK Riau Gelar Silaturahmi Dengan Nasabah Cabang Pembantu Bagan Batu;2024-01-09T10:57:11.000Z;https://x.com/abdul200385/status/1744674674808885675;[];
@CNNIndonesia;OJK Cabut 3 Izin Asuransi, 7 Dalam Pengawasan Khusus;2024-01-09T10:48:07.000Z;https://x.com/CNNIndonesia/status/1744672391807336945;[];
@CNNIndonesia;OJK Minta Bank Blokir Lebih dari 4.000 Rekening Terkait Judi Online;2024-01-09T10:45:51.000Z;https://x.com/CNNIndonesia/status/1744671820618641574;[];
@berjalankekiri;ojk tau percoyo koncomu sg celukane ambon;2024-01-09T10:45:44.000Z;https://x.com/berjalankekiri/status/1744671791686312347;[];
@klinikhukum;Sering sekali dalam sektor pengawasan lembaga keuangan kita mendengar peran BI dan OJK, apa perbedaan peran kedua lembaga tersebut? Simak penjelasan LAPS SJK pada artikel berikut:;2024-01-09T10:45:00.000Z;https://x.com/klinikhukum/status/1744671607761829963;[];
@Beritasatu;OJK Optimistis Penyaluran Kredit Bank 2024 Dua Digit https://beritasatu.com/ekonomi/2793280/ojk-optimistis-penyaluran-kredit-bank-2024-dua-digit?utm_source=dlvr.it&utm_medium=twitter… #beritasatu #news #berita;2024-01-09T10:41:06.000Z;https://x.com/Beritasatu/status/1744670625585856980;[];
@validnewsid;Meski tekanan di pasar keuangan pada akhir 2023 mereda, namun OJK tetap mewaspadai beberapa faktor risiko dan menyusun strategi mitigasi untuk menjaga stabilitas sektor keuangan. https://validnews.id//ekonomi/jaga-stabilitas-keuangan-ojk-sebut-miliki-strategi-mitigasi-risiko…;2024-01-09T10:40:31.000Z;https://x.com/validnewsid/status/1744670481125662881;[];
@uncazer;Info magang di ojk batch bulan februari udah ada yang di terima ? Khusus di ojk pusat;2024-01-09T10:35:57.000Z;https://x.com/uncazer/status/1744669330003169399;[];
@Bisniscom;Kapan Transaksi Bitcoin Cs Diawasi OJK? Ini Kisi-kisinya;2024-01-09T10:28:07.000Z;https://x.com/Bisniscom/status/1744667359804317996;[];
@Bisniscom;Sempat Disindir Jokowi, OJK Ungkap Fakta Pembelian SBN oleh Bank;2024-01-09T10:26:09.000Z;https://x.com/Bisniscom/status/1744666864612253816;[];
@Bisniscom;OJK Sebut Ada 13 Pinjol Bandel yang Ogah Turunkan Bunga Pinjaman;2024-01-09T10:21:06.000Z;https://x.com/Bisniscom/status/1744665595591987291;[];
@detikfinance;Otoritas Jasa Keuangan (OJK) mengungkap ada 60 perusahaan mengantre melakukan penawaran umum perdana saham atau initial public offering (IPO).;2024-01-09T10:17:42.000Z;https://x.com/detikfinance/status/1744664739408400853;[];
@aktualofficial;OJK: Akumulasi Nilai 41 Pengguna Jasa di Bursa Karbon Rp30,91 Miliar https://aktual.com/ojk-akumulasi-nilai-41-pengguna-jasa-di-bursa-karbon-rp3091-miliar/?utm_source=dlvr.it&utm_medium=twitter… #aktualcom #Aktualofficial;2024-01-09T10:13:13.000Z;https://x.com/aktualofficial/status/1744663609849131434;[];
@antarabiz;OJK: Piutang industri pembiayaan tumbuh lebih rendah jadi 14,14 persen http://dlvr.it/T17ygD;2024-01-09T10:12:07.000Z;https://x.com/antarabiz/status/1744663330873323631;[];
@pinjolupdate;Bayar Pinjol PinjamDuit di tgl jatuh tempo pasti angsuran berikutnya ikutan terpilih, tidak bisa di un-select, dan total yang harus dibayar jadi lebih banyak. Ikuti aja sampai keluar nomor VA nya, trus bayar JUMLAH YANG SUDAH JATUH TEMPO AJA. Aman. #PinjolLicik #Pinjamduit #OJK;2024-01-09T10:09:23.000Z;https://x.com/pinjolupdate/status/1744662643082989697;[];
@antarabiz;OJK: Akumulasi nilai 41 pengguna jasa di Bursa Karbon Rp30,91 miliar;2024-01-09T10:07:37.000Z;https://x.com/antarabiz/status/1744662199455687065;[];
@antarabiz;OJK buat aturan baru guna perkuat perlindungan konsumen dan masyarakat;2024-01-09T10:07:36.000Z;https://x.com/antarabiz/status/1744662196158967980;[];
@Bisniscom;Nasabah Tolak Restrukturisasi, OJK Minta Jiwasraya Cari Solusi;2024-01-09T10:07:05.000Z;https://x.com/Bisniscom/status/1744662067381231842;[];
@Fortune_IDN;13 Pinjol Masih Terapkan Bunga Tinggi, OJK Ancam Beri Sanksi;2024-01-09T10:06:08.000Z;https://x.com/Fortune_IDN/status/1744661825172779466;[];
@carikarirku;Perbankan Sudah Blokir 4.000 Rekening Judi Online Atas Permintaan OJK https://newsnusantara.site/2024/01/perbankan-sudah-blokir-4000-rekening.html… Prabowo Pendukung 02 Depok;2024-01-09T10:05:37.000Z;https://x.com/carikarirku/status/1744661695551947207;[];
@antarabiz;OJK: Premi asuransi Januari-November 2023 capai Rp290,21 triliun http://dlvr.it/T17xWh;2024-01-09T10:02:38.000Z;https://x.com/antarabiz/status/1744660947065843840;[];
@infobanknews;Satu Bank Perekonomian Rakyat (BPR) kembali ditutup di awal tahun 2024. Otoritas Jasa Keuangan (OJK) pada 4 Januari lalu, telah menutup BPR Wijaya Kusuma. Selengkapnya: https://infobanknews.com/makin-tegas-ojk-mau-sikat-bpr-yang-bermasalah/… #infobank #ojk #ojkindonesia #bank #banking #perbankan #perbankanindonesia #BPR;2024-01-09T10:00:47.000Z;https://x.com/infobanknews/status/1744660482793877840;['https://pbs.twimg.com/media/GDZHUtNXAAA0wXL?format=jpg&name=small'];
@suaraindonews_;OJK Buat Aturan Baru Perkuat Perlindungan Konsumen dan Masyarakat https://suaraindonews.com/ojk-buat-aturan-baru-perkuat-perlindungan-konsumen-dan-masyarakat/…;2024-01-09T10:00:10.000Z;https://x.com/suaraindonews_/status/1744660323796488198;['https://pbs.twimg.com/media/GDZHUZHa0AAR98X?format=jpg&name=small'];
@jeyyyhq;anyone klo oren keluar kondar coba aduin ke website ojk.;2024-01-09T09:22:09.000Z;https://x.com/jeyyyhq/status/1744650756672934119;['https://pbs.twimg.com/media/GDY-nMOaUAAoXpv?format=jpg&name=900x900'];
@detikfinance;OJK mencatat sepanjang 2023 telah melakukan tindakan tegas kepada pihak-pihak pelanggar di pasar modal. Apa sanksinya?;2024-01-09T09:22:04.000Z;https://x.com/detikfinance/status/1744650737433432296;[];
@KATADATAcoid;7 Perusahaan Asuransi Bermasalah Masuk Pengawasan Khusus OJK http://dlvr.it/T17sXb;2024-01-09T09:20:05.000Z;https://x.com/KATADATAcoid/status/1744650238647005581;[];
@kumparan;OJK meminta perbankan untuk memblokir lebih dari 4.000 rekening terkait judi online (judol) ilegal dan pinjaman online (pinjol) ilegal. Hal itu dilakukan guna membatasi ruang gerak pelaku pinjol dan judol ilegal. #bisnisupdate #update #bisnis #oneliner http://bit.ly/3SbzYer;2024-01-09T09:15:36.000Z;https://x.com/kumparan/status/1744649111205196166;['https://pbs.twimg.com/media/GDY8_DVXEAEH8qG?format=jpg&name=small'];
@GATRA_com;OJK: Bursa Karbon RI Cetak Nilai Perdagangan Rp30,91 Miliar per Desember 2023;2024-01-09T09:15:02.000Z;https://x.com/GATRA_com/status/1744648966346862833;[];
@suarapenacom;OJK Terbitkan POJK Baru untuk Lindungi Konsumen dan Masyarakat, Simak 11 Poin Pentingya;2024-01-09T09:14:47.000Z;https://x.com/suarapenacom/status/1744648903570645216;[];
@antarabiz;OJK: Ruang pertumbuhan industri pasar modal Indonesia masih luas http://dlvr.it/T17rvN;2024-01-09T09:14:35.000Z;https://x.com/antarabiz/status/1744648855755644972;[];
@pinjolupdate;"Ternyata denda Kredivo besar juga ya. Angsuran sebulan 1jt an, telat sehari dendanya sekitar 110rb. Ada ""Denda Keterlambatan"" dan ""Bunga Keterlambatan."" Apaan coba #Kredivo #Pinjol #OJK";2024-01-09T09:11:43.000Z;https://x.com/pinjolupdate/status/1744648133878190345;[];
@ilhamiasnawi;OJK Ramal Fed Pangkas Bunga 75 Basis Poin Sepanjang 2024;2024-01-09T09:11:30.000Z;https://x.com/ilhamiasnawi/status/1744648076235845982;[];
@bankneocommerce;8. Karyawan, keluarga dari karyawan, agency, dan semua pihak ketiga dari Bank Neo Commerce dan Natur DILARANG mengikuti kegiatan ini Bank Neo Commerce berizin & diawasi OJK serta merupakan bank peserta penjaminan LPS #neobank #BankNeoCommerce #UntungAdaneobank #naturbeauty;2024-01-09T09:10:42.000Z;https://x.com/bankneocommerce/status/1744647877027340379;[];@bankneocommerce
@KATADATAcoid;OJK Tunggu Rencana Aksi Jiwasraya Setelah Restrukturisasi Berakhir http://dlvr.it/T17r2M;2024-01-09T09:05:34.000Z;https://x.com/KATADATAcoid/status/1744646584485482520;[];
@antarabiz;OJK proyeksikan pertumbuhan kredit 2024 melanjutkan tren positif http://dlvr.it/T17qqf;2024-01-09T09:05:08.000Z;https://x.com/antarabiz/status/1744646476830294259;[];
@VIVAcoid;OJK: Sektor Jasa Keuangan Nasional Terjaga Baik;2024-01-09T09:02:35.000Z;https://x.com/VIVAcoid/status/1744645832350273720;[];
@himabisnisunri;sudah difasilitasi oleh berbagai macam perusahaan mulai dari Bank, Fintech P2P Lending, dan lainnya. Sedangkan marketplace penyedia jasa paylater seharusnya bekerja sama dengan OJK untuk menjamin keamanannya. Sebenarnya paylater itu boleh ga sihh dalam Islam?? Sobat Adbis yukk;2024-01-09T08:59:58.000Z;https://x.com/himabisnisunri/status/1744645174113014135;[];@himabisnisunri
@IDNTimes;OJK Perintahkan Perbankan Blokir Rekening Terduga Pinjol Ilegal;2024-01-09T08:58:06.000Z;https://x.com/IDNTimes/status/1744644704590061656;[];
@cnbcindonesia;RI Darurat Judi Online, OJK Perintah Blokir 4.000 Rekening;2024-01-09T08:54:07.000Z;https://x.com/cnbcindonesia/status/1744643701865853017;[];
@kumparan;Otoritas Jasa Keuangan (OJK) menyampaikan rencana bisnis bank (RBB) Tahun Buku 2024-2026. #bisnisupdate #update #bisnis #text;2024-01-09T08:52:06.000Z;https://x.com/kumparan/status/1744643198067339264;[];
@liputan6dotcom;OJK Ramal Fed Pangkas Bunga 75 Basis Poin Sepanjang 2024 http://dlvr.it/T17p4F #Bisnis;2024-01-09T08:47:05.000Z;https://x.com/liputan6dotcom/status/1744641931727307186;[];
@BloombergTZ;OJK: Jumlah Investor Kripto RI 18 Juta, Nilai Capai Rp17 T;2024-01-09T08:47:04.000Z;https://x.com/BloombergTZ/status/1744641930749956120;[];
@Media_Asuransi;Otoritas Jasa Keuangan (OJK) menerbitkan Peraturan Otoritas Jasa Keuangan (POJK) Nomor 22 Tahun 2023 tentang Pelindungan Konsumen dan Masyarakat di Sektor Jasa Keuangan. https://mediaasuransinews.co.id/keuangan/ojk-terbitkan-pojk-nomor-22-2023-untuk-perkuat-peraturan-perlindungan-konsumen-dan-masyarakat/…;2024-01-09T08:31:36.000Z;https://x.com/Media_Asuransi/status/1744638036837839191;[];
@GATRA_com;OJK: Sektor Jasa Keuangan RI Tetap Kokoh Hadapi Potensi Perlambatan Pertumbuhan Ekonomi Global https://gatra.com/news-589814-ekonomi-ojk-sektor-jasa-keuangan-ri-tetap-kokoh-hadapi-potensi-perlambatan-pertumbuhan-ekonomi-global.html…;2024-01-09T08:30:01.000Z;https://x.com/GATRA_com/status/1744637640509661536;[];
@kumparan;OJK bakal membuka lowongan kerja melalui Program Pendidikan Calon Staf OJK Angkatan ke-7 (PCS 7) di tahun ini. #bisnisupdate #update #bisnis #text;2024-01-09T08:28:06.000Z;https://x.com/kumparan/status/1744637157531377734;[];
@tempodotco;Bos OJK Ungkap Kondisi Sektor Keuangan RI di Tengah Perlambatan Ekonomi Global https://bisnis.tempo.co/read/1819102/bos-ojk-ungkap-kondisi-sektor-keuangan-ri-di-tengah-perlambatan-ekonomi-global?utm_source=Twitter&utm_medium=dlvr.it… #TempoBisnis;2024-01-09T08:26:37.000Z;https://x.com/tempodotco/status/1744636783902806171;[];
@KATADATAcoid;OJK Beri Sanksi 16 Startup Pinjol karena Modal dan Kredit Macet;2024-01-09T08:23:09.000Z;https://x.com/KATADATAcoid/status/1744635908639568189;[];
@cnbcindonesia;Siap-siap! OJK Akan Buka Rekrutmen Tahun Ini, Simak Bocorannya;2024-01-09T08:20:31.000Z;https://x.com/cnbcindonesia/status/1744635248359690739;[];
@zyzvb;Se oke itu memang pakai gopaylater, tapi tetep harus on track ya tagihannya biar slik ojk nya tetep clean guys;2024-01-09T08:18:59.000Z;https://x.com/zyzvb/status/1744634861187711422;[];@adina_sel
@kumparan;11 poin yang dibuat OJK untuk lindungi konsumen di antaranya hak dan kewajiban calon konsumen hingga mekanisme penagihan agunan kredit. #bisnisupdate #update #bisnis #text;2024-01-09T08:18:35.000Z;https://x.com/kumparan/status/1744634759660310832;[];
@kompascom;Menurut OJK, sepanjang 2023 indikator perekonomian global masih menunjukkan adanya potensi perlambatan pertumbuhan di beberapa negara http://dlvr.it/T17lX4;2024-01-09T08:17:15.000Z;https://x.com/kompascom/status/1744634427479842821;[];
@egibusyeo;Bjirrr udah kelar menangisi apolo ojk yang lieurrrr itu sekarang ganti nangisin tpn;2024-01-09T08:16:01.000Z;https://x.com/egibusyeo/status/1744634117017555412;['https://pbs.twimg.com/media/GDYve9JaIAAiudK?format=jpg&name=small'];
@KATADATAcoid;OJK Minta Bank Aktif Blokir Rekening Judi Online dan Pinjol Ilegal;2024-01-09T08:13:06.000Z;https://x.com/KATADATAcoid/status/1744633381479150039;[];
@antarabiz;OJK: Kredit restrukturisasi COVID-19 menurun jadi Rp285,32 triliun http://dlvr.it/T17l1D;2024-01-09T08:12:07.000Z;https://x.com/antarabiz/status/1744633133511934056;[];
@Bisniscom;Lowongan Karier di OJK 2024, Rekrutmen untuk Level Staf;2024-01-09T08:10:35.000Z;https://x.com/Bisniscom/status/1744632746289631505;[];
@404___errror;OJK masih boleh dipercaya? Kelalaian OJK menelan korban WanaArtha dan Kresna Life se nasional Indonesia, di diamkan 4 tahun dan terus berlanjut? OJK komunikasi dengan buronan? @ojkindonesia @PDI_Perjuangan @mohmahfudmd @Kemlu_RI @kompascom @CNNIndonesia @ganjarpranowo @jokowi;2024-01-09T07:58:03.000Z;https://x.com/404___errror/status/1744629595356463104;['https://pbs.twimg.com/media/GDYqrJ9bYAAGpFf?format=png&name=small'];@ojkindonesia
@Media_Asuransi;Otoritas Jasa Keuangan (OJK) melaporkan bahwa pendapatan premi industri Asuransi per November 2023 sebesar Rp290,21 triliun. https://mediaasuransinews.co.id/asuransi/premi-asuransi-per-november-2023-sebesar-rp29021-triliun/…;2024-01-09T07:53:09.000Z;https://x.com/Media_Asuransi/status/1744628360523993199;[];
@Bisniscom;OJK: 7 Perusahaan Asuransi dalam Pengawasan Khusus;2024-01-09T07:52:13.000Z;https://x.com/Bisniscom/status/1744628125001273646;[];
@kumparan;Selain judi online, OJK juga minta bank blokir 85 rekening diduga pinjol ilegal. #bisnisupdate #update #bisnis #text;2024-01-09T07:46:07.000Z;https://x.com/kumparan/status/1744626591953740289;[];
@tebaksiapayo;Sem 5 di Bapenda Liat rep ada yg di ojk, kira² kerjanya ngapain aja ya? https://x.com/collegemenfess/collegemenfess/status/1744351797202792855…;2024-01-09T07:44:54.000Z;https://x.com/tebaksiapayo/status/1744626284825886738;[];
@officialnova_id;Catat! Aturan Baru Besaran Bunga Pinjol 2024 yang Ditetapkan OJK;2024-01-09T07:42:06.000Z;https://x.com/officialnova_id/status/1744625578530210042;[];
@Kilas_berita_;OJK Sebut Stabilitas Jasa Keuangan Nasional Terjaga dengan Baik http://dlvr.it/T17h4Q;2024-01-09T07:42:05.000Z;https://x.com/Kilas_berita_/status/1744625577112543413;[];
@KATADATAcoid;OJK Catat ada 60 Perusahaan Mau IPO, Total Nilainya Rp 10 Triliun;2024-01-09T07:39:33.000Z;https://x.com/KATADATAcoid/status/1744624940190740712;[];
@aris3ono;https://finance.detik.com/berita-ekonomi-bisnis/d-7132298/begini-kondisi-sektor-jasa-keuangan-ri-di-tengah-perlambatan-ekonomi-global… Otoritas Jasa Keuangan (OJK) menyatakan stabilitas sektor jasa keuangan Indonesia masih terjaga baik di tengah risiko perlambatan ekonomi global.;2024-01-09T07:32:09.000Z;https://x.com/aris3ono/status/1744623074463416703;[];
@KATADATAcoid;OJK: Kinerja IHSG Tertinggi Kedua di ASEAN Sepanjang 2023;2024-01-09T07:29:35.000Z;https://x.com/KATADATAcoid/status/1744622431007101335;[];
@Bisniscom;OJK Sebut Ada 60 Perusahaan Antre IPO, Target Dana Rp10 Triliun;2024-01-09T07:29:07.000Z;https://x.com/Bisniscom/status/1744622310722818316;[];
@Bisniscom;Data OJK: Aset BPJS Kesehatan Tergerus, BPJS Ketenagakerjaan Mendaki;2024-01-09T07:23:05.000Z;https://x.com/Bisniscom/status/1744620796163817511;[];
@superradioid;Marak Penipuan di WA, Mahfud MD Minta OJK Atur Penyebaran Informasi Perbankan - https://superradio.id/marak-penipuan-di-wa-mahfud-md-minta-ojk-atur-penyebaran-informasi-perbankan/…;2024-01-09T07:05:17.000Z;https://x.com/superradioid/status/1744616315674124691;['https://pbs.twimg.com/media/GDYfSuxbgAAN3UE?format=jpg&name=small'];
@bankneocommerce;PT Bank Neo Commerce Tbk berizin & diawasi Otoritas Jasa Keuangan (OJK) serta merupakan bank peserta penjaminan Lembaga Penjamin Simpanan (LPS) #neobank #BankNeoCommerce #UntungAdaneobank;2024-01-09T07:02:31.000Z;https://x.com/bankneocommerce/status/1744615617767031013;[];@bankneocommerce
@Asetku_id;Siapa yang belum familiar dengan istilah LAPS SJK? Singkatnya, LAPS SJK adalah satu-satunya lembaga yang menyelesaikan sengketa di luar pengadilan khusus untuk sektor jasa keuangan yang sudah memperoleh izin operasional oleh OJK. Lalu apa peran dan fungsinya? Kenali disini yuk!;2024-01-09T07:00:01.000Z;https://x.com/Asetku_id/status/1744614987320992177;['https://pbs.twimg.com/media/GDYWj_Fa0AA00FE?format=jpg&name=small', 'https://pbs.twimg.com/media/GDYWlYQaEAE6DNq?format=jpg&name=360x360', 'https://pbs.twimg.com/media/GDYWnKLbMAAqyXg?format=jpg&name=360x360'];
