User;Text;Date;Tweet Link;Media Links;Reply To
@dotpierces;oalah okay okay;2023-12-13T23:59:47.000Z;https://x.com/dotpierces/status/1735087150998429905;[];@bagaskeram
@dotpierces;ayah aman tapii???;2023-12-13T23:48:29.000Z;https://x.com/dotpierces/status/1735084304198463606;[];@bagaskeram
@dotpierces;oalah...;2023-12-13T23:48:19.000Z;https://x.com/dotpierces/status/1735084264079888525;[];@bagaskeram
@wh1thehun;klo dana ga bakal balik susah, dana tuh udah dr lama udah ga diawasi ojk;2023-12-13T23:36:45.000Z;https://x.com/wh1thehun/status/1735081353061003338;[];@taetearchivee
@byeonwoohye;DANA udah ga diawasin OJK aja udh aneh sih.. Mainan org dalem kata gue;2023-12-13T23:32:33.000Z;https://x.com/byeonwoohye/status/1735080294406053932;['https://pbs.twimg.com/media/GBOYikDaIAAfPK_?format=jpg&name=small', 'https://pbs.twimg.com/media/GBOYi73aoAAwHLU?format=jpg&name=small', 'https://pbs.twimg.com/media/GBOYjUVaoAAQoGV?format=jpg&name=small'];
@ronaelv;kalo ga salah skrg dana itu udh ga dilindungin ojk juga deh ka, kmrin smpet ada kasus yg dana gabisa ditarik juga semoga kasusnya segera selesai dan uangnya bisa kembali yaa ka…;2023-12-13T23:19:39.000Z;https://x.com/ronaelv/status/1735077049839362109;[];@taetearchivee
@nrsky_;sbg pengguna dana aktif (dulu), sering bgt dikirimi vt tmn kalo dana udah g diawasi ojk. dr situ langsung pindah uang dan uninstall. but, skrg masi pake dana buat tf ke rek bank, soalnya gada adm dan bisa dilakukan di alfa. hmm gatau deh next masi pake metode ini atau berenti aja;2023-12-13T22:53:01.000Z;https://x.com/nrsky_/status/1735070345856679997;['https://pbs.twimg.com/media/GBOYikDaIAAfPK_?format=jpg&name=small', 'https://pbs.twimg.com/media/GBOYi73aoAAwHLU?format=jpg&name=small', 'https://pbs.twimg.com/media/GBOYjUVaoAAQoGV?format=jpg&name=small'];
@yvrgvrlll;ka better jgn perna masukin duit ke DANA @danawallet krn bahaya bgt DANA gk ada OJK nya. uda banyak bgt kasus penipun gini;2023-12-13T22:50:31.000Z;https://x.com/yvrgvrlll/status/1735069717629685776;[];@taetearchivee
@ttalgiuyujaem;Sejak banyak yg bilang dana sering kebobolan begini dan katanya udah ga diawasin ojk lagi, gue udah ga berani nyimpen duit di dana turut prihatin kak semoga masalahnya cepet selesai uangnya bisa balik lagi;2023-12-13T22:45:20.000Z;https://x.com/ttalgiuyujaem/status/1735068411733200930;['https://pbs.twimg.com/media/GBOYikDaIAAfPK_?format=jpg&name=small', 'https://pbs.twimg.com/media/GBOYi73aoAAwHLU?format=jpg&name=small', 'https://pbs.twimg.com/media/GBOYjUVaoAAQoGV?format=jpg&name=small'];
@ndamauyauda;kasus dana nih udah banyak bgt lo, aku sampe uninn karna takut knp2 dan udah ngga di awasi ojk lagi;2023-12-13T22:18:38.000Z;https://x.com/ndamauyauda/status/1735061694941118496;[];@taetearchivee
@potretmanadoid;OJK Larang Iklan Pinjol Ilegal Ditayangkan di Google, Facebook, dan Instagram http://dlvr.it/T0643X;2023-12-13T22:16:05.000Z;https://x.com/potretmanadoid/status/1735061052608647216;[];
@dzkyyh_;DANA itu emang ga aman sih buat nominal besar, udah banyak kasus yang tiba2 ilang uangnya & ga balik krn DANA juga ga diawasi OJK. Semoga bisa segera menemukan jalan keluar ya kak;2023-12-13T22:02:17.000Z;https://x.com/dzkyyh_/status/1735057580286992699;[];@taetearchivee
@R39404Rida;Pa tolong aplikasi belanja online yg berwarna oren dievaluasi lg bunganya amat sgt mencekik. Telat satu bulan harus bayar 2 bulan ditambah denda 5%..dan terrornya dh keluar dari kontak darurat. OJK hnya MENGAWASI. Tidak bnyk brtindak sbgaimna pengaduan masyarakat. Terima kasih.;2023-12-13T22:01:13.000Z;https://x.com/R39404Rida/status/1735057312061194359;[];@mohmahfudmd
@Udin85853988;Dana kayanya udah lepas dari ojk deh, makanya nder kalo udah sekali ada yang kesedot langsung tarik aja semua;2023-12-13T20:53:42.000Z;https://x.com/Udin85853988/status/1735040320163995835;[];@taetearchivee
@atree8396;DANA bukannya udah gak diawasin OJK ya??? udahlah jangan dipake, pake yang lain aja;2023-12-13T20:39:14.000Z;https://x.com/atree8396/status/1735036678782509568;[];@taetearchivee
@scotchwithcoke;semenjak dana lepas dari ojk, ga pernah simpen duit lagi di dana paling isi cepet, terus udah buat topup game;2023-12-13T20:38:21.000Z;https://x.com/scotchwithcoke/status/1735036455322575220;['https://pbs.twimg.com/media/GBOYikDaIAAfPK_?format=jpg&name=small', 'https://pbs.twimg.com/media/GBOYi73aoAAwHLU?format=jpg&name=small', 'https://pbs.twimg.com/media/GBOYjUVaoAAQoGV?format=jpg&name=small'];
@protprotttt;dana emg udh ga diawasi ojk kak;2023-12-13T20:29:02.000Z;https://x.com/protprotttt/status/1735034113336254953;[];@taetearchivee
@N0b0dy2121;Semoga dananya bisa balik ya nder. Lebih baik pake line bank atau bluu deh leboh aman. Soalnya Dana gak bawah ojk lagi setauku;2023-12-13T20:10:27.000Z;https://x.com/N0b0dy2121/status/1735029437694103559;[];@taetearchivee
@dotpierces;jam segini bukannya tidur malah galau;2023-12-13T20:04:14.000Z;https://x.com/dotpierces/status/1735027872405017052;[];
@modmaudd;katanya dana udh ga di bawah ojk lg jg kak emg baiknya pindah aja sih;2023-12-13T18:53:45.000Z;https://x.com/modmaudd/status/1735010133401555087;[];@taetearchivee
@holygraeil;Kok masih ada sih yg make dana? gue dari awal tahun udah skip banget pake dana, qris dana gue ada 1 jt an gak bisa cair sampe capek email berkali-kali dan ngirim bukti tetep aja gak bisa. Apalagi skrg udah gak diawasin ojk.;2023-12-13T18:52:54.000Z;https://x.com/holygraeil/status/1735009921920553014;['https://pbs.twimg.com/media/GBOYikDaIAAfPK_?format=jpg&name=small', 'https://pbs.twimg.com/media/GBOYi73aoAAwHLU?format=jpg&name=small', 'https://pbs.twimg.com/media/GBOYjUVaoAAQoGV?format=jpg&name=small'];
@ubacotbgt;Aku udah lama ngga pake dana semenjak ada info dia udah ga di awasi ojk lagi, tadi temen mamahku mau bayar keperluan paud (mamahku guru paud) pas berhasil tf langsung aku pindahin ke rek lain, biar aman;2023-12-13T18:47:08.000Z;https://x.com/ubacotbgt/status/1735008467361092092;['https://pbs.twimg.com/media/GBP9AZ0aUAMD5qr?format=jpg&name=900x900', 'https://pbs.twimg.com/media/GBOYikDaIAAfPK_?format=jpg&name=120x120', 'https://pbs.twimg.com/media/GBOYi73aoAAwHLU?format=jpg&name=120x120', 'https://pbs.twimg.com/media/GBOYjUVaoAAQoGV?format=jpg&name=120x120'];
@dotpierces;jangan cemberuutt;2023-12-13T18:39:08.000Z;https://x.com/dotpierces/status/1735006454866923677;[];@YAOIBASERP
@bukanhadee;anjing?;2023-12-13T18:37:29.000Z;https://x.com/bukanhadee/status/1735006038724858168;[];
@dotpierces;ide bagus bukan?? jelas dong, ethan gitu;2023-12-13T18:34:36.000Z;https://x.com/dotpierces/status/1735005316339880263;[];@Taehyuag
@dotpierces;atau gak airnya di ejekin dulu aja, biar panas sendiri jadinya;2023-12-13T18:28:24.000Z;https://x.com/dotpierces/status/1735003754167234724;[];@Taehyuag
@dotpierces;GAKPAPAA;2023-12-13T18:27:49.000Z;https://x.com/dotpierces/status/1735003608247324766;[];@leefeyi
@kariramst;dana sekarang emang serem, soalnya udah ga diawasi OJK kak;2023-12-13T18:12:49.000Z;https://x.com/kariramst/status/1734999832811688259;[];@taetearchivee
@dotpierces;dimasak dulu atuh pak airnya biar panas;2023-12-13T18:10:43.000Z;https://x.com/dotpierces/status/1734999302156734945;[];@Taehyuag
@LayananOjk;Kak channel Telegram nya mau di jual tidak?;2023-12-13T17:21:06.000Z;https://x.com/LayananOjk/status/1734986816330289258;[];@_tsunage
@phomerine;Udah gak pernah pake dana soalnya dana kan gak diawasi sama OJK...jadi ngeri banget udah sering ada case kayak gini.;2023-12-13T17:09:06.000Z;https://x.com/phomerine/status/1734983799673606213;['https://pbs.twimg.com/media/GBOYikDaIAAfPK_?format=jpg&name=small', 'https://pbs.twimg.com/media/GBOYi73aoAAwHLU?format=jpg&name=small', 'https://pbs.twimg.com/media/GBOYjUVaoAAQoGV?format=jpg&name=small'];
@alfredoopasta;samaa aku jg ojk KP, belum ada info niih sampe skrgg berkabar ya kaa;2023-12-13T16:53:53.000Z;https://x.com/alfredoopasta/status/1734979966859890957;[];@kapicangcam
@dotpierces;yoihh;2023-12-13T16:47:53.000Z;https://x.com/dotpierces/status/1734978459720626337;[];@eatemy
@dotpierces;baby shark dudududu ajah;2023-12-13T16:47:21.000Z;https://x.com/dotpierces/status/1734978323594584343;[];@Taehyuag
@dailychimintul;Baru denger ihhh blu? Diawasi ojk ga yaa;2023-12-13T16:37:32.000Z;https://x.com/dailychimintul/status/1734975855385096502;[];@pqjmnx
@libccallpacks;kapan-kapan lah OJK disuruh Diklat ke Singapore Board Totalisator atau OJK merger sama Totte;2023-12-13T16:36:42.000Z;https://x.com/libccallpacks/status/1734975642431865182;[];
@efghijknp;Dana udah ga di bawah ojk lagi mending ati ati aja klo tarok duit banyak disitu;2023-12-13T16:35:50.000Z;https://x.com/efghijknp/status/1734975427570172040;['https://pbs.twimg.com/media/GBOYikDaIAAfPK_?format=jpg&name=small', 'https://pbs.twimg.com/media/GBOYi73aoAAwHLU?format=jpg&name=small', 'https://pbs.twimg.com/media/GBOYjUVaoAAQoGV?format=jpg&name=small'];
@shinelogy;the real bf air cok soale kon membawa efek buruk kyk e nak pacarmu mas makane ta dadi ark ojk kemenyek;2023-12-13T16:33:44.000Z;https://x.com/shinelogy/status/1734974895682170954;[];@ub_mfs
@cheeriobruh;sorry gue ga bisa ngasih saran alternatif dompet digital lainnya ya .. tiap tmn gue nanya balik 'emng kalo bkn dana ap dong' gue selalu jwb 'mbca hehehe' karna emng ril cmn pake itu doang.. jd qrt gue diatas ini sbnrnya lebih ke ngasih info aja kalo dana sdh tidak diawasi ojk.;2023-12-13T16:33:42.000Z;https://x.com/cheeriobruh/status/1734974889008976290;[];@cheeriobruh
@aloel_ku;ok ditunggu semoga laporan ini, tidak lanjut ke pengaduan OJK;2023-12-13T16:30:45.000Z;https://x.com/aloel_ku/status/1734974145178538014;[];@HaloBCA
@dailychimintul;Ehhh blm OJK kah? Baru tauu;2023-12-13T16:29:20.000Z;https://x.com/dailychimintul/status/1734973791011525087;[];@monopinkk
@monopinkk;jgn, dana udh ga ojk.. bahayaa udh bnyk kasus;2023-12-13T16:27:11.000Z;https://x.com/monopinkk/status/1734973248616710240;[];@dailychimintul
@ThamrinCarolina;Lu tanya kpk jangan lu gembor...itu food estate yg jumlahnya trilyunan mane hasilnye kemane tuh duit!!! Dah dibilangin dah di cek kpk kl dia korupsi ga bakalan kredit rumah dodol...yg jelas2 aja.tu ojk..ppatk itu pasfi ngecek .lu tanya pj http://gub.si heru;2023-12-13T16:26:08.000Z;https://x.com/ThamrinCarolina/status/1734972985420009614;[];@jiuliong30
@cheeriobruh;gue ga pernah cape utk nanya 'kenapa lu masih pake dana dah? kan itu udh gak diawasin ojk' ke temen gue yg masih pake itu dompet online..;2023-12-13T16:23:50.000Z;https://x.com/cheeriobruh/status/1734972406492729494;['https://pbs.twimg.com/media/GBOYikDaIAAfPK_?format=jpg&name=small', 'https://pbs.twimg.com/media/GBOYi73aoAAwHLU?format=jpg&name=small', 'https://pbs.twimg.com/media/GBOYjUVaoAAQoGV?format=jpg&name=small'];
@MeyyJpg;Mana dana udah gak diawasin OJK lagi;2023-12-13T16:17:36.000Z;https://x.com/MeyyJpg/status/1734970836363448461;['https://pbs.twimg.com/media/GBOYikDaIAAfPK_?format=jpg&name=small', 'https://pbs.twimg.com/media/GBOYi73aoAAwHLU?format=jpg&name=small', 'https://pbs.twimg.com/media/GBOYjUVaoAAQoGV?format=jpg&name=small'];
@alyssaulya;ojk tidak swasta friendly;2023-12-13T16:13:40.000Z;https://x.com/alyssaulya/status/1734969848013455573;['https://pbs.twimg.com/media/GBPZ4PaagAAnFwx?format=jpg&name=small'];
@daninrzn;Lk onk seng salah seng tabrak wong e disek ojk lngsung d ulti ng wong tuwane;2023-12-13T16:06:55.000Z;https://x.com/daninrzn/status/1734968150461186110;[];
@dotpierces;yuks;2023-12-13T15:53:09.000Z;https://x.com/dotpierces/status/1734964684560933270;[];@YAOIBASERP
@cellcavya1;"pindahin aja gasih kak? soalnya kemarin dgr"" dana ga diawasi OJK lagi?";2023-12-13T15:36:39.000Z;https://x.com/cellcavya1/status/1734960533982617685;[];@_empathy9
@yeolxxich;semenjak ada kabar ga diawasi ojk lagi waktu itu lgsg aku hapus apknya soalnya abis itu juga banyak keluhan;2023-12-13T15:34:19.000Z;https://x.com/yeolxxich/status/1734959943546266092;[];@_empathy9
@bukanhadee;g tulus;2023-12-13T15:27:53.000Z;https://x.com/bukanhadee/status/1734958324746190928;[];@airlanggafess
@kerinsane;Gowoen wes mas, ojk sampek nang kuto ku tapi;2023-12-13T15:25:51.000Z;https://x.com/kerinsane/status/1734957814341402878;[];@sosmedkeras
@dantsus;Sekedar buku pajangan. Buktikan pelaksana pengawasan manajemen bank @KemenBUMN @erickthohir jelas melakukan catat palsu keuangan kredit2 macet npl. Slik @ojkindonesia jadi lancar. Laba diaku 3,..T NPL 3,5. Jika OJK koreksi kembali NPL akan >10, berani tidak OJK. Jangan memble;2023-12-13T15:22:23.000Z;https://x.com/dantsus/status/1734956941099889084;['https://pbs.twimg.com/media/GBPOHw3akAANlLh?format=jpg&name=360x360', 'https://pbs.twimg.com/media/GBPOHw5bIAAtyI6?format=jpg&name=360x360', 'https://pbs.twimg.com/media/GBPOHw5a4AAz8wq?format=jpg&name=360x360', 'https://pbs.twimg.com/media/GBPOHw6aoAAm74y?format=jpg&name=360x360'];@ojkindonesia
@sweetyschon;yo tantrum yo kerja wes ojk mengiri, menganan ae cek tau;2023-12-13T15:12:58.000Z;https://x.com/sweetyschon/status/1734954573855678951;['https://pbs.twimg.com/media/GBPL_Z8bwAAbXFZ?format=jpg&name=900x900'];
@sleepykluwi;KAGATAU MEL KATANYA SIH KEDAFTAR OJK TAPI KOK INI GUE KEK DIJEBAK YE ANJINK TBTB UDH KEDAFTAR;2023-12-13T15:09:54.000Z;https://x.com/sleepykluwi/status/1734953798618280183;[];@ranianaaa
@miawddo;iyaaaa sama, bener2 cuma kupake lewat doang dana skrg.. banyak bgt kejadian begini, mana skrg udah ga diawasin ojk;2023-12-13T14:54:45.000Z;https://x.com/miawddo/status/1734949986994164168;[];@fullofdoyie
@Dymas_EP;ndakik ndakik tok ae wes ojk ngecemes ngalor ngidul percuma kalahan masio mbok kei saran gak di gawe;2023-12-13T14:37:20.000Z;https://x.com/Dymas_EP/status/1734945604139438163;[];
@Bisniscom;OJK Bongkar Penyebab Nasabah Bisa Tarik Utang di 40 Pinjol Ilegal;2023-12-13T14:16:35.000Z;https://x.com/Bisniscom/status/1734940381425655895;[];
@libccallpacks;OJK nyambi bandar judi niy... jangan-jangan. kok sama bank secrecy mentah!;2023-12-13T14:04:11.000Z;https://x.com/libccallpacks/status/1734937263837233624;['https://pbs.twimg.com/media/GBL3dopbIAAVsnS?format=jpg&name=small', 'https://pbs.twimg.com/media/GBL4AX0bYAAqOPn?format=jpg&name=small'];
@libccallpacks;pinjol ... salah, judi malah tambah salah. OJK kerjane opo wae tho?;2023-12-13T14:01:22.000Z;https://x.com/libccallpacks/status/1734936552403509580;[];
@jungkookmybaeby;Ahh kak im sorry to say this tp udh gada harapan lagi (unless ke polisi atau hackers sekalian). Soalnya dana tuh udh ga aman lagi krn udh ga diback up ojk. Mending jgn bikin transaksi besar lewat dana. Udh bnyk korbannya. Km liat aja di komen ig dana pada bermasalah smua:(;2023-12-13T13:55:53.000Z;https://x.com/jungkookmybaeby/status/1734935174046179529;[];@taetearchivee
@bankneocommerce;PT Bank Neo Commerce Tbk berizin & diawasi Otoritas Jasa Keuangan (OJK) serta merupakan bank peserta penjaminan Lembaga Penjamin Simpanan (LPS) #neobank #BankNeoCommerce #UntungAdaneobank #naturbeauty;2023-12-13T13:53:09.000Z;https://x.com/bankneocommerce/status/1734934483969982610;[];@bankneocommerce
@YelliumInggrit;Emang agak lain sih hehehheh, terus kalau gondok ojk suwe-suwe ben segera dibahas;2023-12-13T13:49:20.000Z;https://x.com/YelliumInggrit/status/1734933525156237563;[];@Hoyiyah
@mizuyamamari;OH GOD OJK;2023-12-13T13:47:54.000Z;https://x.com/mizuyamamari/status/1734933166161309820;[];@smplmnteleche
@Mfthrrzkk;Ngetik yg bener dulu pak;2023-12-13T13:42:52.000Z;https://x.com/Mfthrrzkk/status/1734931898525438009;[];@GanjarMahfudApp
@bukanhadee;wes parkir mang nak st mdiun;2023-12-13T13:28:42.000Z;https://x.com/bukanhadee/status/1734928331844493822;[];@chstahwang
@drunksuga;kak dana udah ga dibawah OJK, makanya ga rekomen buat nyimpen uang jutaan soalnya kl kenapa2 susah ngurusnya;2023-12-13T13:28:16.000Z;https://x.com/drunksuga/status/1734928221781799368;[];@taetearchivee
@ojkindonesia;OJK Luncurkan Peta Jalan Pengawasan Perilaku Pelaku Usaha Jasa Keuangan, Edukasi, dan Pelindungan Konsumen 2023-2027 Sobat OJK, OJK meluncurkan Peta Jalan Pengawasan Perilaku Pelaku Usaha Jasa Keuangan, Edukasi, dan Pelindungan Konsumen Tahun 2023-2027 di Jakarta.;2023-12-13T12:42:02.000Z;https://x.com/ojkindonesia/status/1734916586270756899;[];
@ojkindonesia;Info seputar update kebijakan dan kegiatan OJK lainnya, kunjungi kanal Youtube Otoritas Jasa Keuangan (OJK TV). https://youtube.com/shorts/aE3GVmSS0FA?si=_V-E21eidKofxPxA… #OJK #OJKLeadership #InsanOJK #Transformasi #OJKOne #Kinerja #OJKTV;2023-12-13T12:20:46.000Z;https://x.com/ojkindonesia/status/1734911237300134366;[];@ojkindonesia
@ojkindonesia;Melalui Webinar OJK Leadership Forum 2023: Building A High Performing Team, Wakil Ketua Dewan Komisioner OJK Mirza Adityaswara menegaskan pentingnya memiliki tim yang baik, solid dan bertanggung jawab serta memiliki kinerja yang tinggi.;2023-12-13T12:20:46.000Z;https://x.com/ojkindonesia/status/1734911234494075010;[];@ojkindonesia
@ojkindonesia;OJK Leadership Forum 2023: Strategi Ciptakan Team Berkinerja Tinggi Sobat OJK, OJK terus menjaga komitmen transformasi institusi dalam menjalankan fungsi sebagai regulator di industri jasa keuangan.;2023-12-13T12:20:45.000Z;https://x.com/ojkindonesia/status/1734911230933168418;[];
@ojkindonesia;Info seputar update kebijakan dan kegiatan OJK lainnya, kunjungi kanal Youtube Otoritas Jasa Keuangan (OJK TV). https://youtube.com/shorts/YbHBFeqbvb8?si=n2EyON22LwJZdd_m… #OJK #NetZeroEmission #BursaKarbon #ACMF #ASEAN #Taksonomi #GreenEconomy #OJKTV;2023-12-13T12:17:23.000Z;https://x.com/ojkindonesia/status/1734910384510034164;[];@ojkindonesia
@ojkindonesia;Demikian ditegaskan Kepala Eksekutif Pengawas Pasar Modal, Keuangan Derivatif, dan Bursa Karbon OJK Inarno Djajadi saat menghadiri Webinar ASEAN Transition Finance Guidance yang diselenggarakan oleh ASEAN Capital Markets Forum (ACMF).;2023-12-13T12:17:22.000Z;https://x.com/ojkindonesia/status/1734910381573931073;[];@ojkindonesia
@ojkindonesia;Peran Penting Pendanaan Transisi Keuangan Menuju Net Zero Emission di ASEAN Sobat OJK, dalam upaya mencapai target pengurangan emisi karbon, OJK terus mendorong sinergi seluruh regulator & pihak terkait untuk meningkatkan pendanaan transisi menuju tercapainya net zero emission.;2023-12-13T12:17:21.000Z;https://x.com/ojkindonesia/status/1734910378600259604;[];
@matahariajaib;gawe mas: unfuck your life dan ojk merasa kek mc anime sg depresi moro sukses, urip g segampang iku gawe mbak: find your best partner dan sebaiknya segera keluar dari sini;2023-12-13T12:04:17.000Z;https://x.com/matahariajaib/status/1734907090081312844;[];@atasnamaahra
@Pengendiemaja;Tanpa NPWP Dan Slip Gaji Cair Hitungan Menit. EasyCash Pinjaman Online yang udah OJK dan Legal. Monggo ini infonya,;2023-12-13T10:40:00.000Z;https://x.com/Pengendiemaja/status/1734885876465799342;['https://pbs.twimg.com/media/F2A8lWFaEAAQbvP?format=jpg&name=small'];
@m_alzhara;Tangi le wes surup nek ngimpi OJK dukur² le mengko kesampluk pesawat gundulmu;2023-12-13T10:39:44.000Z;https://x.com/m_alzhara/status/1734885810351353906;[];@JadineGood
@bukanhadee;jojoran;2023-12-13T10:39:08.000Z;https://x.com/bukanhadee/status/1734885661487050973;[];@airlanggafess
@bukanhadee;ya allah isi rekeningku 10jt;2023-12-13T10:38:55.000Z;https://x.com/bukanhadee/status/1734885607066001825;[];
@alfredoopasta;kaak, kaka ojk pusat atau regionaal? udah dapet pengumuman beloom;2023-12-13T10:38:18.000Z;https://x.com/alfredoopasta/status/1734885449880219838;[];@kapicangcam
@bukanhadee;terpantau krl ws smpek mediun;2023-12-13T10:33:27.000Z;https://x.com/bukanhadee/status/1734884227311923702;[];
@PRFMnews;Jelang Nataru Banyak Masyarakat Ngutang Buat Liburan, OJK Ingatkan Pilih Pinjol Legal;2023-12-13T10:19:08.000Z;https://x.com/PRFMnews/status/1734880627038757330;[];
@trenasiadotcom;OJK Larang Iklan Pinjol Ilegal di Google, Facebook, hingga Instagram http://dlvr.it/T04Wvh #TrenAsia;2023-12-13T10:01:38.000Z;https://x.com/trenasiadotcom/status/1734876222080078086;[];
@bukanhadee;di 1,5 bulan trakhir gw merasa idup gw lebi enjoy, byk org datang dan pergi, bukan apa” tp bisa jadi buat bahan belajar dan semakin percaya bahwa apa yg udh tuhan kasi ke kita, semua yg pernah dateng ke kita bakal hilang dan pergi;2023-12-13T09:58:24.000Z;https://x.com/bukanhadee/status/1734875408515146069;[];
@Media_Asuransi;Menurut Kepala Eksekutif Pengawas Perilaku Pelaku Usaha Jasa Keuangan, Edukasi, dan Perlindungan Konsumen OJK, Friderica Widyasari Dewi, Peta Jalan Pengawasan PEPK 2023-2027 memiliki empat strategi sebagai pilar penyokongnya.;2023-12-13T09:55:52.000Z;https://x.com/Media_Asuransi/status/1734874770888700189;[];
@hxeyiin;serumah sm ayha ojk lebih ok;2023-12-13T09:46:14.000Z;https://x.com/hxeyiin/status/1734872344945127613;[];@kqarina
@tempodotco;OJK Telusuri Aset Asuransi yang Sudah Di-CIU hingga ke Luar Negeri https://bisnis.tempo.co/read/1808974/ojk-telusuri-aset-asuransi-yang-sudah-di-ciu-hingga-ke-luar-negeri?utm_source=Twitter&utm_medium=dlvr.it… #TempoBisnis;2023-12-13T09:43:35.000Z;https://x.com/tempodotco/status/1734871678323511740;[];
@Faisal_Wage;Ojk nyangkut lo ndek gunung;2023-12-13T09:36:53.000Z;https://x.com/Faisal_Wage/status/1734869995212194288;[];@efun1999
@bukanhadee;knapa lo iri, iya?!;2023-12-13T09:21:26.000Z;https://x.com/bukanhadee/status/1734866104579998070;[];@ryantapiboong
@ivooxid;Kepala Departemen Literasi, Inklusi Keuangan dan Komunikasi OJK, Aman Santosa mengungkapkan literasi dan inklusi keuangan syariah masih tertinggal jika dibandingkan dengan keuangan konvensional. @ojkindonesia;2023-12-13T08:37:34.000Z;https://x.com/ivooxid/status/1734855065691947466;[];
@haibundacom;Seru! Para Bunda Belajar Cara Atur Keuangan Keluarga di Talkshow Beranda x OJK;2023-12-13T08:05:39.000Z;https://x.com/haibundacom/status/1734847034832859566;[];
@dantsus;Pak Erick pesan jangan terkecoh bank @KemenBUMN melakukan kejahatan perbankan. Kredit2 masalah macet NPL dibukukan seolah ada pembayaran. Slik @ojkindonesia lancar. Tujuan menyenangkan pak Erick ada laba tinggi 3,..T bagi dividen. NPL bisa 3, semua kejahatan. OJK takut bapak.;2023-12-13T07:52:12.000Z;https://x.com/dantsus/status/1734843648473432548;['https://pbs.twimg.com/media/GBNnGMRbEAAGAbI?format=jpg&name=360x360', 'https://pbs.twimg.com/media/GBNnGMWawAA_h-P?format=jpg&name=360x360', 'https://pbs.twimg.com/media/GBNnGMXaIAAMjV3?format=jpg&name=360x360', 'https://pbs.twimg.com/media/GBNnGMRa0AAWmC0?format=jpg&name=360x360'];@erickthohir
@Jurnalpatroli_;OJK: Pinjol Sering Dijadikan Modal Untuk Main Judi Online! https://jurnalpatrolinews.co.id/keuangan/ojk-pinjol-sering-dijadikan-modal-untuk-main-judi-online/…;2023-12-13T07:49:04.000Z;https://x.com/Jurnalpatroli_/status/1734842860317573291;[];
@Pengendiemaja;Gais jangan dong pake pinjol ilegal ! kalo beneran butuh cari yang trusted dilindungi OJK. Ini aku rekomendasiin salah satu yng pernah aku pake;2023-12-13T07:30:00.000Z;https://x.com/Pengendiemaja/status/1734838062365192243;[];
@SINDOnews;Miris, OJK beberkan data jika banyak masyarakat gunakan pinjol untuk judi online;2023-12-13T07:20:00.000Z;https://x.com/SINDOnews/status/1734835544679416061;[];
@debtcollhunter;pakai hukum rimba aja nih buat orang-orang di @ojkindonesia ? boleh tidak pak? @CCICPolri @DivHumas_Polri soalnya sindikat seperti ini dibiarkan, kan masyarakat bingung mau lapor kesiapa, ojk aja lepas tangan, @jokowi @KPK_RI @KPPU;2023-12-13T07:16:56.000Z;https://x.com/debtcollhunter/status/1734834775498866773;[];@KhaleedBhadrika
@Syahrul_250;Loh loh, ojk eman pageran e sg wes estetip jare ark saiki;2023-12-13T07:03:12.000Z;https://x.com/Syahrul_250/status/1734831317416833198;[];@senja_pagi_hari
@dotpierces;mau dongs;2023-12-13T06:45:05.000Z;https://x.com/dotpierces/status/1734826758489403796;[];@YAOIBASERP
@emthorif;OJK Desak Google dan Meta Hentikan Penayangan Iklan Pinjol Ilegal;2023-12-13T06:33:48.000Z;https://x.com/emthorif/status/1734823918123516344;[];
@KodokBastard;Dana sudah tidak OJK,tiati nis;2023-12-13T06:20:23.000Z;https://x.com/KodokBastard/status/1734820541352358349;[];@anisfauziyyahh
@bukanhadee;absen aman saatnya balek kampung;2023-12-13T06:17:56.000Z;https://x.com/bukanhadee/status/1734819925280411919;['https://pbs.twimg.com/media/GBNRhkFaEAArbm2?format=jpg&name=900x900'];
@trenasiadotcom;OJK Proyeksikan Suku Bunga The FED Turun di Kuartal II 2024 http://dlvr.it/T046tj #TrenAsia;2023-12-13T06:06:09.000Z;https://x.com/trenasiadotcom/status/1734816959110451662;[];
@sumsel_update;OJK Catat 783 Permasalahan Pinjol di Sumsel, Didominasi Warga Palembang;2023-12-13T06:00:05.000Z;https://x.com/sumsel_update/status/1734815435600834860;[];
@ojkindonesia;Perempuan Berdaya, UMKM Berjaya Sobat OJK, UMKM memiliki dampak dan kontribusi yang besar bagi perekonomian dan dapat menyerap banyak tenaga kerja.;2023-12-13T05:57:00.000Z;https://x.com/ojkindonesia/status/1734814657209409715;[];
@duniasidejob;butuh pinjaman segera? Coba download Akulaku! Jelas aman dan diawasi OJK langsung dapat hadiah tunai Rp20.000 dan voucher Rp165.000 download disini : https://s.akulaku.com/FLtTY4;2023-12-13T05:23:00.000Z;https://x.com/duniasidejob/status/1734806100740845588;[];
@cikupitaw;Gasss, tp lek mokondo ojk diterusno;2023-12-13T05:19:06.000Z;https://x.com/cikupitaw/status/1734805119559139718;[];@darjofess
@antarabiz;OJK terus tegakkan integritas guna tingkatkan budaya antikorupsi http://dlvr.it/T043WF;2023-12-13T05:16:05.000Z;https://x.com/antarabiz/status/1734804363271651821;[];
@MHisy4;Mugo menang ti ojk kyk emyu membengi;2023-12-13T05:13:32.000Z;https://x.com/MHisy4/status/1734803721643852170;[];@idextratime
@dwisetyawt;Kalau dari keterangan OJK sii ilegal vang;2023-12-13T05:11:49.000Z;https://x.com/dwisetyawt/status/1734803285478178870;[];@Expeliarmuszzz
@bukanhadee;kenal deket sm org yg bisa se open minded itu kyk wow fix dia org keren;2023-12-13T05:11:27.000Z;https://x.com/bukanhadee/status/1734803196860936286;[];
